{
  "schema_version": "1.0.0",
  "device_id": "device_demo_001",
  "heartbeat_id": "heartbeat_demo_001",
  "reported_at": "2026-10-03T10:00:00Z",
  "firmware_version": "0.3.0",
  "capabilities": [
    "audio_input",
    "audio_output",
    "wifi",
    "display",
    "touch"
  ],
  "capability_revision": 3,
  "connection": {
    "state": "online",
    "transport": "wifi"
  },
  "network_quality": {
    "level": "good",
    "rssi_dbm": -58,
    "latency_ms": 42,
    "packet_loss_percent": 1
  },
  "time_sync": {
    "state": "synchronized",
    "source": "sntp",
    "last_synced_at": "2026-10-03T10:00:00Z",
    "offset_ms": 12
  },
  "offline": {
    "state": "online",
    "reason": "none",
    "fallback_active": false,
    "pending_telemetry": 0
  },
  "provisioning": {
    "state": "provisioned",
    "wifi_configured": true,
    "session_state": "ready",
    "dropped_events": 0,
    "last_provisioned_at": "2026-10-03T09:58:00Z",
    "events": [
      {
        "event_id": "provisioning_00000001",
        "event_type": "provisioning_started",
        "sequence": 1,
        "detail_code": "first_run",
        "duration_ms": 0,
        "firmware_version": "0.7.0"
      },
      {
        "event_id": "provisioning_00000002",
        "event_type": "wifi_configured",
        "sequence": 2,
        "detail_code": "ble_provisioning",
        "duration_ms": 4200,
        "firmware_version": "0.7.0"
      },
      {
        "event_id": "provisioning_00000003",
        "event_type": "network_reconnected",
        "sequence": 3,
        "detail_code": "wifi_station",
        "duration_ms": 1800,
        "firmware_version": "0.7.0"
      },
      {
        "event_id": "provisioning_00000004",
        "event_type": "time_synced",
        "sequence": 4,
        "detail_code": "sntp",
        "duration_ms": 900,
        "firmware_version": "0.7.0"
      },
      {
        "event_id": "provisioning_00000005",
        "event_type": "binding_confirmed",
        "sequence": 5,
        "detail_code": "guardian_binding",
        "duration_ms": 0,
        "firmware_version": "0.7.0"
      }
    ]
  },
  "diagnostics": {
    "schema_version": "1.0.0",
    "newest_sequence": 12,
    "dropped_boot_events": 0,
    "boot_events": [
      {
        "event_id": "boot_00000001",
        "event_type": "boot",
        "sequence": 10,
        "uptime_ms": 1200,
        "boot_count": 3,
        "reset_reason": "power_on",
        "firmware_version": "0.4.0"
      }
    ],
    "latest_failure": {
      "event_id": "failure_00000011",
      "event_type": "module_failure",
      "sequence": 11,
      "module_name": "network_manager",
      "error_code": "ESP_ERR_TIMEOUT",
      "failure_count": 1,
      "firmware_version": "0.4.0"
    },
    "recovery_events": [
      {
        "event_id": "recovery_00000012",
        "event_type": "module_recovered",
        "sequence": 12,
        "module_name": "network_manager",
        "firmware_version": "0.4.0"
      }
    ],
    "interaction_events": [
      {
        "event_id": "interaction_00000013",
        "event_type": "wake_detected",
        "sequence": 13,
        "detail_code": "wake_word",
        "duration_ms": 0,
        "firmware_version": "0.4.0"
      },
      {
        "event_id": "interaction_00000014",
        "event_type": "factory_reset_requested",
        "sequence": 14,
        "detail_code": "guardian_request",
        "duration_ms": 0,
        "firmware_version": "0.4.0"
      }
    ]
  }
}
